Title,URL,Body,Upvotes,Time,Key
Excruciating high-pitched whine,https://www.reddit.com/r/teslamotors/comments/hxqpj5/excruciating_highpitched_whine/,"I took delivery of a Model Y 2 days ago (an early July build w/ VIN #22XXX) and am encountering a problem w/ a very high-pitched whine (the best analogue that comes to mind is it sounds like a dental implement) from what I believe to be the rear motor. It typically consists of a high-pitched whine that correlates with pedal input above a certain speed, persists at certain speeds, pulsing / beeping of sorts, et cetera. We didn’t hear this in either of the demo Model Ys we test drove. And this is definitely not something I've experienced in my Model 3 dual motor AWD. It's so egregious that despite how much I love my Model 3 and generally advocate Tesla to others I wouldn't have opted into this vehicle for my wife at all. Had a test drive been part of delivery acceptance it also wouldn't have been accepted.

The earliest available service appointment I could get scheduled is the 31st. That concerns me given it's outside the 7 day return window and I really have no appetite for a protracted battle w/ Tesla over whether this is ""within spec"" or not. I also really have no desire to desire to return it and be returned to the queue since the vehicle is otherwise in a good enough state (it has a few trim & seat alignment issues that I expect ought be routine to adjust).

Has anyone here encountered, or better yet, achieved resolution on this?

Here's a link to what I hear (w/ a low cut filter applied to separate from tire road noise): [Model Y High Pitched Whine](https://www.dropbox.com/s/7sy16wddy9wv8se/Tesla%20Model%20Y%20High%20Pitched%20Whine%20-%20July%202020.mp3?dl=0)

For reference also another thread on Tesla Motors Club on this topic: [https://teslamotorsclub.com/tmc/posts/4865301/](https://teslamotorsclub.com/tmc/posts/4865301/)",13,2020-07-26 05:38:24,250
Tesla nabs $65 million tax break to build Cybertruck factory in Austin,https://www.reddit.com/r/teslamotors/comments/hx10v5/tesla_nabs_65_million_tax_break_to_build/,,2209,2020-07-25 00:38:07,251
Why Tesla Model Y is Their Most Important Car! [Auto Focus Ep 5],https://www.reddit.com/r/teslamotors/comments/hxe22n/why_tesla_model_y_is_their_most_important_car/,,166,2020-07-25 13:17:22,252
Audio Bug,https://www.reddit.com/r/teslamotors/comments/hy0wxq/audio_bug/,"I know that there are times people get that audio bug where it starts to make a popping noise and can randomly cut out/pause your phone.

This occurs to me whenever my phone loses LTE connection like in a parking garage and then I drive out.

The audio bug usually just makes the phone audio jittery, but there was a recent occurrence where everything just went silent. No GPS, no phone audio, and no turn signal noise.

It was fixed with the double button reset.

Anyone else get this bug and anyone know how to get a more permanent fix than just resetting? It would've sucked having this occur on the freeway during a trip.

Side question: Can I do the screen reset while driving or do I have to wait until I am parked somewhere?",2,2020-07-26 16:49:06,253
Austin Gigafactory Construction - July 24,https://www.reddit.com/r/teslamotors/comments/hxf1sn/austin_gigafactory_construction_july_24/,,59,2020-07-25 14:25:50,254
Tesla Gigafactory Austin 07/24/20 - Tesla Terafactory 1st Drone Shots!,https://www.reddit.com/r/teslamotors/comments/hxd8cv/tesla_gigafactory_austin_072420_tesla_terafactory/,,71,2020-07-25 12:23:07,255
ANNOUNCEMENT: Tesla 800 MWh Megapack project NV’s Gigawatt 1 initiative,https://www.reddit.com/r/teslamotors/comments/hx9zpq/announcement_tesla_800_mwh_megapack_project_nvs/,,99,2020-07-25 09:00:09,256
Tesla Offers 'Giant Contract' To Any Company That Can Efficiently Mine Nickel,https://www.reddit.com/r/teslamotors/comments/hx4wbu/tesla_offers_giant_contract_to_any_company_that/,,226,2020-07-25 04:29:10,257
Autopilot still needs work for parked cars,https://www.reddit.com/r/teslamotors/comments/hxeczm/autopilot_still_needs_work_for_parked_cars/,,38,2020-07-25 13:37:56,258
"A Touchless, Robotic charging setup at my work.",https://www.reddit.com/r/teslamotors/comments/hwnxwo/a_touchless_robotic_charging_setup_at_my_work/,,7017,2020-07-24 08:56:42,259
"Daily Q&A, Discussion, and Support Thread - July 25",https://www.reddit.com/r/teslamotors/comments/hxjsv1/daily_qa_discussion_and_support_thread_july_25/,"If you are new here (or even if you're not), please skim through our [Rules](https://www.reddit.com/r/teslamotors/wiki/rules) to get more familiarity on potential updates or changes and what to expect.

Use this recurring thread for basic Q&A, vehicle assistance, today's topics, sightings, customization, shop item discussions, etc.  **If you are a new owner and want to share your experiences, look for our recurring Monday [New Delivery/Owner](https://www.reddit.com/r/teslamotors/search/?q=%22New+Delivery+and+Owners+Thread%22&include_over_18=on&restrict_sr=on&sort=new) threads.**

**Have a curiosity or concern?**   
- [Displayed/Rated Range](https://www.reddit.com/r/teslamotors/comments/epy1uh/daily_discussion_support_thread_january_17/fenj4n8) | [Tesla Support](https://www.tesla.com/support) | [Winter Driving](https://www.tesla.com/support/winter-driving-tips) | [Software Updates + Megathreads](https://www.reddit.com/r/teslamotors/wiki/softwareupdates)  

**Useful sites for vehicle management, software tracking, trip planning, and more**    
- [Teslascope](https://teslascope.com/software) | [TeslaFi](https://teslafi.com/firmware/) | [EV-FW](http://ev-fw.com/track-reports.php) | [Teslabout](https://teslabout.com/firmware) | [Useful Sites Wiki](https://www.reddit.com/r/teslamotors/wiki/usefulsites)    

**Vehicle Manuals - U.S.**  
- [Model S](https://www.tesla.com/sites/default/files/model_s_owners_manual_north_america_en_us.pdf) | [Model 3](https://www.tesla.com/sites/default/files/model_3_owners_manual_north_america_en.pdf) | [Model X](https://www.tesla.com/sites/default/files/model_x_owners_manual_north_america_en.pdf) | [Model Y](https://www.tesla.com/sites/default/files/model_y_owners_manual_north_america_en.pdf)  
- **NEW - [Model 3 Video Manuals](https://www.youtube.com/c/TeslaManuals/videos)**  

**Resources:**  
- [Rules](https://www.reddit.com/r/teslamotors/wiki/rules)  
- [Gigathread](https://www.reddit.com/r/teslamotors/comments/cdxuwh/gigathread_of_resources/) - Recent Highlights and Links    
- [Popular Accessories](https://www.reddit.com/r/teslamotors/wiki/accessories)  
- r/AutoDetailing - Cleaning/detailing tips  
- [Discord Live Chat](https://discord.gg/7WuEqAW)  
- [Subreddit Wiki](https://www.reddit.com/r/teslamotors/wiki/index)  
- [Tesla Vehicle History Comparisons](https://docs.google.com/spreadsheets/d/1Rv464J1RsXNBNddy008IPsQfVrO4kHPh_L4HWKpG4bo/edit#gid=0)  
- Print your own [Shareable Card](https://drive.google.com/drive/folders/1URFRBNFIcuhpKr_fgtPaYXVc83m7EHQs?usp=sharing) by u/backstreetatnight and u/110110  

**Please be kind**, [genuine](https://www.reddit.com/r/teslamotors/comments/8rc3jg/be_genuine/), and welcoming.  If you want to share a photo, you can easily create an image post on Imgur and include it in your comment.  Find past discussions [here](https://www.reddit.com/r/teslamotors/search?q=author%3AAutoModerator+title%3A%22Discussion%22&restrict_sr=on&include_over_18=on&sort=new&t=all).",7,2020-07-25 21:10:07,260
Brandenburg Minister Confirms: Tesla Will Produce Battery Cells In Grünheide,https://www.reddit.com/r/teslamotors/comments/hx301g/brandenburg_minister_confirms_tesla_will_produce/,,185,2020-07-25 02:43:54,261
Tesla PowerWall July 2020 update,https://www.reddit.com/r/teslamotors/comments/hxce0m/tesla_powerwall_july_2020_update/,,22,2020-07-25 11:29:03,262
Elon - Giga Texas,https://www.reddit.com/r/teslamotors/comments/hx2jlm/elon_giga_texas/,,108,2020-07-25 02:16:40,263
Need some targeted advice about buying an older Model S,https://www.reddit.com/r/teslamotors/comments/hxdnq7/need_some_targeted_advice_about_buying_an_older/,"Hi all, My first reddit post. I have been thinking for a long time about buying my first Tesla. I worry. I have browsed the prior threads on buying a used Model S, but I think my needs for a car are different than those expressed by those posters. Hoping to get more targeted advice.

My situation: I do not want a Model 3 since I would hope to fit my family in the car for long trips. I also do not care much about some of the advanced technology--except for the aspects that will improve the basic functions of a car, i.e. faster charging, more capacity etc. I don't care about auto pilot or any related self driving technology. I am the type of person that uses maybe 4 functions on my iPhone. Basically, I'd like a reliable used electric car for around the $30-35K mark that I can keep for 5-8 years. Looks like I might be able to get something like a 5 year-old Model S with 50-80K miles for that. So my questions: Is there a minimum model year where the technology is a must have for basic performance issues, i.e. charging, reliability, etc.? Or is there not much difference (again, basic performance wise) between a 2013 with 50k mileage and a 2018 with the same mileage? Regarding EVs generally, is mileage as much of an issue, or is the age of the battery a big/bigger concern? Is there anything I should be aware of when looking at Model S with this age/mileage? Any advice much appreciated!

Actually, one more question, is there any big upside to buying used from Tesla? I hate car dealerships and was intending to buy from a third party. thanks!",15,2020-07-25 12:51:00,264
The Tesla Model Y Made In Germany Will Be Quite Different,https://www.reddit.com/r/teslamotors/comments/hx31xr/the_tesla_model_y_made_in_germany_will_be_quite/,,80,2020-07-25 02:46:58,265
HomeLink no longer working after HW3 upgrade. Solution in post.,https://www.reddit.com/r/teslamotors/comments/hx5941/homelink_no_longer_working_after_hw3_upgrade/,"Recently got my HW3 upgrade after waiting over a year (it’s awesome)! The install took a little over 3 hours but it worked perfectly except my garage opener via Tesla HomeLink and front power windows no longer worked. I resolved the front power windows by reading the Tesla forums, basically had to reprogram the windows with the window button. (Do a full cycle of windows by lighting pressing the window button and right before the window closes do a hard pull like you would do when you want to power close the window, then power windows should work again)

For the HomeLink issue I chatted with a Tesla Representative on the website and waited 30 minutes plus for a representative which was ko help because they just offered the simple troubleshooting options such as reprogram HomeLink, delete profile and program again which I had already tried.

Then I created a Mobile Service request and Tesla contacted me next day via SMS saying that they needed to push a firmware update to my car specifically for HomeLink because they forgot to do that when HW 3 was installed. I installed the firmware update and then reprogrammed my garage door opener to HomeLink and works perfect again.

I couldn’t find this information anywhere online so I hope it helps someone in the future.

Note: I have a Model 3",51,2020-07-25 04:46:31,266
MY black trim...,https://www.reddit.com/r/teslamotors/comments/hx2o95/my_black_trim/,,39,2020-07-25 02:24:26,267
"Model 3 needs up to 25% more energy at the wallbox compared to what it reports, according to ADAC (German AAA) test",https://www.reddit.com/r/teslamotors/comments/hx0oae/model_3_needs_up_to_25_more_energy_at_the_wallbox/,"The ADAC compared real energy consumption of several electric cars at a 22kW wallbox to what the bordcomputer reports. The difference goes from roughly 10% for the Kia e-niro up to almost 25 for the Tesla M3 LR.

Original article (german): https://presse.adac.de/meldungen/adac-ev/technik/ladeverlust.html

Disclaimer: The ADAC naturally has a lot of ties to the german auto makers even if they say they're neutral. Pretty interesting read nevertheless.

Any Idea why the charging losses might be so big?",31,2020-07-25 00:13:10,268
Issues with phone call audio after HW3 upgrade,https://www.reddit.com/r/teslamotors/comments/hxanzr/issues_with_phone_call_audio_after_hw3_upgrade/,"I got my 2018 Model 3 mid range upgraded from 2.5 to 3.0 last week.  In the last few days I found that the in car Bluetooth audio is now HORRIBLE.  It sounds like a deep bass and you can’t make out the words.

I tried:
Soft reset(2 scroll wheels)
Hard reset( plus brake)
Unpairing and pairing
Charging/letting it sleep/trying next day


Anyone have other ideas before I submit a service appointment?",6,2020-07-25 09:39:56,269
Jamie Foxx Drives a Model 3 Performance and LOVES it!,https://www.reddit.com/r/teslamotors/comments/hwlt20/jamie_foxx_drives_a_model_3_performance_and_loves/,,505,2020-07-24 07:04:54,270
Bug: Not sleeping while unlocked,https://www.reddit.com/r/teslamotors/comments/hxcsiy/bug_not_sleeping_while_unlocked/,"With the release of the new ability to exclude walk away locking while at home, I find that both of my Tesla’s no longer go to sleep.    Simply locking the cars will allow them to sleep.

I have turned off the feature for now.   Has anyone else noticed this?   

Both Model 3

Version 2020.24.6.9

[UPDATE] Issue was caused by a setting in Telsamate data logger.    No issue with the car.",0,2020-07-25 11:54:38,271
Buying a Tesla but Using My Credit Union,https://www.reddit.com/r/teslamotors/comments/hx3wm2/buying_a_tesla_but_using_my_credit_union/,"I’m about to pull the trigger on a Tesla, but the loan I’m using is going to be through my credit union. I’ve been approved and ready to go. They told me all I need is the purchase order from Tesla when that happens. One thing I’m stumped on, on the order page you have the option Cash, Lease, or Loan. Does it matter which one I pick? Obviously I know not to pick lease. I feel like this shouldn’t be a big deal, but being such a big purchase, I don’t want to mess this up...haha.",8,2020-07-25 03:35:00,272
Tulsa's failed bid to win the Tesla Factory isn't going over well...,https://www.reddit.com/r/teslamotors/comments/hwkws4/tulsas_failed_bid_to_win_the_tesla_factory_isnt/,,395,2020-07-24 06:20:06,273
"Elon - We are actually looking for revolutionary actuaries for Tesla Insurance! Please inquire, if interested.",https://www.reddit.com/r/teslamotors/comments/hwr582/elon_we_are_actually_looking_for_revolutionary/,,135,2020-07-24 11:57:55,274
Negotiating Price On Used Teslas From Dealerships,https://www.reddit.com/r/teslamotors/comments/hx7qc3/negotiating_price_on_used_teslas_from_dealerships/,"Has anyone bought a used Tesla from a dealership and been able to negotiate? Tesla does not negotiate price on their site but I'm sure the dealerships have some wiggle room.

What year/model/price was it?

How much did you negotiate off?

&#x200B;

EDIT: Apparently I wasn't clear enough. I'm strictly speaking of 3rd party dealership negotiations.",3,2020-07-25 06:58:29,275
Tesla Dashcam storage device,https://www.reddit.com/r/teslamotors/comments/hxf3s6/tesla_dashcam_storage_device/,"I recently got an error saying that my flash drive is too slow to write my dash cam footage. My current set up is USB 3.0 with 128GB of memory and 30mb/S write speeds. I had this stick since I took delivery back in June 13 2020 and I got it brand new just for the Tesla cam. Everything was fine until recently.

Any recommendations on how to solve this issue? 

I also linked the drive I bought.  I am open to any recommendations 
USB www.amazon.com/dp/B0834RMQ9F/ref=cm_sw_r_cp_api_i_yE5gFb7QCV2MD)",1,2020-07-25 14:29:41,276
Bug (reported) in 24.6.9: Arrow to bring up side camera views overlays on top of Charging screen,https://www.reddit.com/r/teslamotors/comments/hwwftl/bug_reported_in_2469_arrow_to_bring_up_side/,,37,2020-07-24 18:00:55,277
Comparison of five SCV3 charging curves,https://www.reddit.com/r/teslamotors/comments/hwshap/comparison_of_five_scv3_charging_curves/,,81,2020-07-24 13:22:48,278
Options to announce alerts or customize unique chimes for alert types,https://www.reddit.com/r/teslamotors/comments/hx3aaw/options_to_announce_alerts_or_customize_unique/,"I always thinks it's a little dangerous for me to take my attention off the road and look at my display to figure out why an alert goes off (autopilot needs me to take over, lane departure warning, front collision alert, etc.) and I often miss it by the time I look down. It'd be great if they announced those alerts, or even allowed you to customize the chimes for different alerts.",6,2020-07-25 03:00:52,279
Nav issue: Tesla thinks that I'm not going to make it to the next supercharger because it thinks that I'm going to be losing 20% during a ferry ride. Please make it count these trips as teleportation 😄,https://www.reddit.com/r/teslamotors/comments/hw9i18/nav_issue_tesla_thinks_that_im_not_going_to_make/,,3144,2020-07-23 16:47:51,280
Can i purchase Tesla model 3 in a country that is not listed on the webpage,https://www.reddit.com/r/teslamotors/comments/hwxeea/can_i_purchase_tesla_model_3_in_a_country_that_is/,"Hi,

I was looking through options of purchasing a new Tesla model 3 from [tesla.com](https://tesla.com)

I live in Lithuania (Europe) and it's not listed in the selection. And for example if i pick Estonia the price is lower than if i would pick Poland. And as i understand the car can't be delivered to Estonia or Lithuania and it would be delivered to Netherlands.

But can i choose whatever European country that has the lowest price for the vehicle and take the delivery of it in Netherlands.

Sorry if it's a stupid question.",17,2020-07-24 19:20:57,281
Bluetooth audio blasting me and my son’s ears. Please help.,https://www.reddit.com/r/teslamotors/comments/hx80td/bluetooth_audio_blasting_me_and_my_sons_ears/,"I absolutely love my model 3 except for this issue. Oftentimes the car audio will end up at max volume and Bluetooth audio from the phone will play at max volume and destroy our ears. 


I have an iPhone XS and the car is on the latest firmware. Does anyone know any settings or tweaks that I can do to prevent this issue?",2,2020-07-25 07:13:40,282
Clicking noise near the back of the car.,https://www.reddit.com/r/teslamotors/comments/hx1cwm/clicking_noise_near_the_back_of_the_car/,"I noticed when I’m going slow with my windows open that every time I almost come to a stop and when I accelerate there is is clicking noise. It sounds like dropping a plastic bottle cap on the ground.

It’s weird that it only happens at stop and acceleration. I’ve checked everywhere around the car to pinpoint it but it’s hard to hear. 

Anyone have any experience with this?",6,2020-07-25 01:00:42,283
My insurance premium for a 2020 Performance Model Y is less than 2018 LR RWD Model 3,https://www.reddit.com/r/teslamotors/comments/hwsol1/my_insurance_premium_for_a_2020_performance_model/,"Just a weird occurrence I thought I would document for you.

Thought this was quite interesting. They never asked for the purchase price of my old Model 3 or the new Model Y, so I'm guessing pricing is just based on the car model alone, which is interesting in itself. Even more fascinating is that the new Model Y is a Performance model, whereas the Model 3 was just a LR RWD.

Anyway, my situation is special; I'm 22 on a Progressive plan with 5 other older cars/drivers, and my premiums for Model 3 for 6 months was $420. (not joking.) With Model Y, I'm paying $393 / 6mos.

The Progressive person explained that because the Model 3 was an older vehicle, that might have something to do with the fact that Model Y was cheaper to insure. Maybe XUV's are cheaper to insure than Sedans, or something.",49,2020-07-24 13:35:37,284
AT&T to drop support for 3G in 2022 which may impact cars made before May 2015,https://www.reddit.com/r/teslamotors/comments/hwjo8a/att_to_drop_support_for_3g_in_2022_which_may/,,221,2020-07-24 05:15:45,285
LAW SUIT: Tesla Accuses Rivian of Stealing Secrets,https://www.reddit.com/r/teslamotors/comments/hwds2q/law_suit_tesla_accuses_rivian_of_stealing_secrets/,,679,2020-07-23 23:09:32,286
Frozen at log in.,https://www.reddit.com/r/teslamotors/comments/hx0wyt/frozen_at_log_in/,"Happened this morning. Got into Model 3. It recognized my setting and the pin pad appeared, music, map, directions to destination... all appeared as normal. 
But when I tapped the screen to enter the PIN, nothing. Nothing.  Nothing at all until I did the “press and hold both click wheels on the steering wheel” trick.  Then it worked fine. 
Had the car nearly two years and never happened before. 
Anyone else? Any thoughts?",5,2020-07-25 00:30:34,287
Fallout Shelter: Renaming Dwellers,https://www.reddit.com/r/teslamotors/comments/hxicwu/fallout_shelter_renaming_dwellers/,"I'm not sure if this is already a feature in my Tesla that I have yet to discover. However, it seems that Teslas lack this in-game feature. I want to know if there is a way to rename your dwellers and, if not, request that tesla add it.",0,2020-07-25 18:50:02,288
"This is no longer about cars,” Chamath Palihapitiya says about Tesla",https://www.reddit.com/r/teslamotors/comments/hwfcqg/this_is_no_longer_about_cars_chamath_palihapitiya/,,427,2020-07-24 01:09:14,289
Tesla pulled in $780.06 in revenue every second in 2019,https://www.reddit.com/r/teslamotors/comments/hwpn6y/tesla_pulled_in_78006_in_revenue_every_second_in/,,64,2020-07-24 10:31:39,290
"Daily Q&A, Discussion, and Support Thread - July 24",https://www.reddit.com/r/teslamotors/comments/hwyknp/daily_qa_discussion_and_support_thread_july_24/,"If you are new here (or even if you're not), please skim through our [Rules](https://www.reddit.com/r/teslamotors/wiki/rules) to get more familiarity on potential updates or changes and what to expect.

Use this recurring thread for basic Q&A, vehicle assistance, today's topics, sightings, customization, shop item discussions, etc.  **If you are a new owner and want to share your experiences, look for our recurring Monday [New Delivery/Owner](https://www.reddit.com/r/teslamotors/search/?q=%22New+Delivery+and+Owners+Thread%22&include_over_18=on&restrict_sr=on&sort=new) threads.**

**Have a curiosity or concern?**   
- [Displayed/Rated Range](https://www.reddit.com/r/teslamotors/comments/epy1uh/daily_discussion_support_thread_january_17/fenj4n8) | [Tesla Support](https://www.tesla.com/support) | [Winter Driving](https://www.tesla.com/support/winter-driving-tips) | [Software Updates + Megathreads](https://www.reddit.com/r/teslamotors/wiki/softwareupdates)  

**Useful sites for vehicle management, software tracking, trip planning, and more**    
- [Teslascope](https://teslascope.com/software) | [TeslaFi](https://teslafi.com/firmware/) | [EV-FW](http://ev-fw.com/track-reports.php) | [Teslabout](https://teslabout.com/firmware) | [Useful Sites Wiki](https://www.reddit.com/r/teslamotors/wiki/usefulsites)    

**Vehicle Manuals - U.S.**  
- [Model S](https://www.tesla.com/sites/default/files/model_s_owners_manual_north_america_en_us.pdf) | [Model 3](https://www.tesla.com/sites/default/files/model_3_owners_manual_north_america_en.pdf) | [Model X](https://www.tesla.com/sites/default/files/model_x_owners_manual_north_america_en.pdf) | [Model Y](https://www.tesla.com/sites/default/files/model_y_owners_manual_north_america_en.pdf)  
- **NEW - [Model 3 Video Manuals](https://www.youtube.com/c/TeslaManuals/videos)**  

**Resources:**  
- [Rules](https://www.reddit.com/r/teslamotors/wiki/rules)  
- [Gigathread](https://www.reddit.com/r/teslamotors/comments/cdxuwh/gigathread_of_resources/) - Recent Highlights and Links    
- [Popular Accessories](https://www.reddit.com/r/teslamotors/wiki/accessories)  
- r/AutoDetailing - Cleaning/detailing tips  
- [Discord Live Chat](https://discord.gg/7WuEqAW)  
- [Subreddit Wiki](https://www.reddit.com/r/teslamotors/wiki/index)  
- [Tesla Vehicle History Comparisons](https://docs.google.com/spreadsheets/d/1Rv464J1RsXNBNddy008IPsQfVrO4kHPh_L4HWKpG4bo/edit#gid=0)  
- Print your own [Shareable Card](https://drive.google.com/drive/folders/1URFRBNFIcuhpKr_fgtPaYXVc83m7EHQs?usp=sharing) by u/backstreetatnight and u/110110  

**Please be kind**, [genuine](https://www.reddit.com/r/teslamotors/comments/8rc3jg/be_genuine/), and welcoming.  If you want to share a photo, you can easily create an image post on Imgur and include it in your comment.  Find past discussions [here](https://www.reddit.com/r/teslamotors/search?q=author%3AAutoModerator+title%3A%22Discussion%22&restrict_sr=on&include_over_18=on&sort=new&t=all).",6,2020-07-24 21:11:38,291
Confirmation (possible) of S/X refresh in November from Tesla,https://www.reddit.com/r/teslamotors/comments/hxhsqu/confirmation_possible_of_sx_refresh_in_november/,"My lease is ending on my Model S.  I received a call today from a Tesla loyalty rep who began telling me they are planning to have a refreshed Model S/X ( referred to it as ""Palladium"" or ""Plaid"" version ) and wanted me to put in a reservation now so I could be early in line.

I found this interesting as I hadn't heard of this before.  He said it's supposed to be a design refresh and a bigger battery with more range but that they will be increasing the price, so I could choose the 402 mile S now or if I wanted to spend more, then they would open a reservation for a 6month window so I could decide.

Has anyone else been told similar information?",0,2020-07-25 17:58:50,292
Nearly done working on Lucifer!,https://www.reddit.com/r/teslamotors/comments/hvz44c/nearly_done_working_on_lucifer/,,9076,2020-07-23 06:26:28,293
