Title,URL,Body,Upvotes,Time,Key
Tesla Widget,https://www.reddit.com/r/teslamotors/comments/hvdtmc/tesla_widget/,"https://preview.redd.it/7nw2gc94g9c51.png?width=1080&format=png&auto=webp&s=a99a93ae9d1bf5b2ef3832454876af0f319ca601

Hello,  I am going to give you a quick tour of my Tesla widget for Android.

I had a previous widget, but saw this concept from user u/d7mtg and was inspired to create my own for Android.

This is not for sale, just a quick look of what you can do with Tasker and KWGT. If there is plenty of interest, I will do several tutorials oh how to do this.

First, here are the requirements for this widget:

You need:

· Android OS

· Tasker

· Tasker Plugin for Tesla

· KWGT Pro

You’ll also need some basic understating of Tasker and KWGT and how it works.

You can watch the video here:

[https://www.youtube.com/watch?v=MApAPTX4qm0](https://www.youtube.com/watch?v=MApAPTX4qm0)

&#x200B;

Below you will find the link for the tasker project that includes all the profiles and tasks I used.

[https://taskernet.com/shares/?user=AS35m8kcoUYE0I3gDh%2FAT4XyMSPfbpC8kz%2Fof1baM1R4n1qaXvWHLKOM3CRXnU6JfKu6&id=Project%3ATesla+Widget](https://taskernet.com/shares/?user=AS35m8kcoUYE0I3gDh%2FAT4XyMSPfbpC8kz%2Fof1baM1R4n1qaXvWHLKOM3CRXnU6JfKu6&id=Project%3ATesla+Widget)

&#x200B;

 

Widget is here:

[https://drive.google.com/file/d/1ksXWiiyxWKryOs0CHVVyMe\_X7sYKnErH/view?usp=drivesdk](https://drive.google.com/file/d/1ksXWiiyxWKryOs0CHVVyMe_X7sYKnErH/view?usp=drivesdk)

Just import to KWGT

&#x200B;

The video part 1 that describes how this works is here:

[https://youtu.be/2elnen3SzMk](https://youtu.be/2elnen3SzMk)

You will need to have some knowledge of Tasker and KWGT to configure this, but if you do, it shouldn’t be that difficult.

If you make any improvements or have any suggestions, please share with the community and let us know how to improve it. This is a personal project, so I am not doing anything special and releasing anything else besides what I have released today.

Enjoy!",59,2020-07-22 07:18:57,356
"Cracked Windshield, Missing Hood....Blood on the Bumper",https://www.reddit.com/r/teslamotors/comments/hurnox/cracked_windshield_missing_hoodblood_on_the_bumper/,,4933,2020-07-21 07:17:21,357
Tesla Finance has the worst support..,https://www.reddit.com/r/teslamotors/comments/hvbiz2/tesla_finance_has_the_worst_support/,"Ive been trying to early terminate my lease since May 1 to potentially get into a Model S or buy the Performance 3/Y. I reached out to Tesla Finance and they said i’d get a quote within in 3 days; I received it 10 days later. Once I got the quote and filled in the form to proceed with the turn in, Ive not heard back from them in nearly a month. Ive called Tesla Finance almost everyday and the voice prompt says the same thing: “Unable to take your call”. 

Ive never experienced such poor service in the auto brands I’ve owned ranging from Hondas to BMWs. Ive never felt so disregarded as a customer who is trying to stay loyal. 

Can anyone share tips on how to get in contact with someone",55,2020-07-22 05:19:59,358
First official Tesla Store in Poland... is build from a truck trailer. IMO this shows how agile Tesla is!,https://www.reddit.com/r/teslamotors/comments/hv92mz/first_official_tesla_store_in_poland_is_build/,,74,2020-07-22 03:13:28,359
Wonder if this is the future.,https://www.reddit.com/r/teslamotors/comments/hv6wct/wonder_if_this_is_the_future/,,101,2020-07-22 00:58:51,360
Help me understand Robotaxi,https://www.reddit.com/r/teslamotors/comments/hvo6dk/help_me_understand_robotaxi/,"I'm having a hard time understanding how the market will react to Robotaxi, assuming that in a year or two (per Elon), all Tesla has to do is flip a switch to bring the robotaxi fleet online.

Given that a Model 3 is \~40k, and you can use it to generate yearly profits that are \~30k, wouldn't that mean that the demand for a Model 3 will become virtually infinite? There's no other asset out there that can generate \~100% return on investment. Will Tesla simply hike up the price of the Model3 to 200k, until the market settles down at least?

If that happens, it's easy to see how this would be a 20k stock.",5,2020-07-22 17:48:27,361
Love my new Model 3 but the sales/ordering process is a joke - a summary of my experience,https://www.reddit.com/r/teslamotors/comments/hval7w/love_my_new_model_3_but_the_salesordering_process/,"TL/DR - just about every aspect of ordering and delivery didn't work properly due to apparent technical issues on Tesla's side. And our dog peed in the new car.

I've been working in customer success roles in technology companies for over 20 years and I'm surprised with how messy my experience was...

Late last year, my wife and I decided it was time to replace our aging two door hatchback and we wanted to go electric for a variety of reasons. I initially reached out via the web form to our local Tesla service station around 20km from my house. 3 months later, I got a first reply (like I'd emailed them yesterday). Shortly thereafter, COVID hit and things slowed down.

A few months later, as things eased here in Canada, I booked a test drive and we decided that a model 3 was the right choice for us. Test drive was good and advisor was helpful and organized. By this time, I had registered on the tesla web side.

Went to put down a deposit to order a car on the web site. Entered my credit card info and the payment could not be processed. Phoned my credit card company and they had no record of the transaction attempt. Called Tesla and they made a few suggestions. Tried another card, etc to no avail. Called the card company again and they still had no record of my now multiple attempts and said the issue was not on their side. Tried a different browser (was using Chrome on Win 10 - switched to Edge) and created a new account with a different email. Now it went through on the same card.

Onto the next step. Setting up registration, delivery and payment information. But the web site wouldn't let me click the button. Another call into Tesla. They had to manually enter an address that I could then edit. This somehow gave me access to enter the rest of the details. Ok.

Then came the insurance step - proof we have insurance. We just put the deposit down and don't have a VIN assigned so don't have insurance for the Tesla yet - what insurance do they want? Existing insurance? Page didn't state what they wanted so I put in our policy on our current car which seemed to be ok.

Ok, 5-9 weeks for delivery so the wait begins. Nothing in inventory locally. Contacted an electrician to install the 14-50 outlet in my garage for fast charging but knowing he's busy, said we just need it done in the next few weeks. No problem.

I hate waiting, so I'm anxiously watching the app for my VIN assignment just to see progress. Days pass. Exactly one week from placing the deposit, we get a call. Car is in and can be picked up on Monday! They send over the paperwork including the VIN. Since this must be a surprise inventory vehicle, I'm a bit concerned that it doesn't have the wireless charger and new USB ports and call Tesla to check on build date. Eventually, they check and it is a newer build so all is well. At the same time, I inquire about buying the 14-50 adapter and adding a referral code to my purchase (no problem on the referral). But nope, they don't stock accessories - must order online from Tesla in the US (1 week for delivery). Strange, but ok.

Message my electrician and he can fit me in next week for more urgent charge outlet install. Just as well that the adapter isn't in until next week anyway.

So we go and pick up the car. Quick inspection, minor/hidden paint chip is fixed while we wait and we're good to go. Delivery specialist person informs us that their internet is down and so can't send us PDF of agreements but we get hard copies. NBD.

Go home, I'm fiddling with getting everything setup and look into the app. Discover that the car is still not marked delivered. Also a pending update is stuck downloading. Check online via PC - same. Phone the delivery center and somehow get somebody at another location who transfers me into oblivion where the call gets dropped. Try again and get voicemail. So try various numbers and get through to a support person at corporate after waiting for 20 minutes. She's great but can't mark my car delivered - must be done by the place I picked it up. But she pushed the update for me.

Next day, still not marked delivered. Waiting on that. Can't configure Premium Connectivity or my wife's account until the car is marked delivered.

Oh, and it looks like the referral code didn't work or at least no credit was applied.

Topping it all off, our first drive was to pick up our kids and take our puppy to the dog park. She peed in the new car (just on the car seat so easy to clean up).

\*\*\* Update - within 30 seconds of submitting this post, I get an email about connectivity and it appears my car is now delivered! Phew.",44,2020-07-22 04:32:06,362
YTD US Auto Sales - Tesla is the only one with YoY growth,https://www.reddit.com/r/teslamotors/comments/huyibu/ytd_us_auto_sales_tesla_is_the_only_one_with_yoy/,,465,2020-07-21 13:44:50,363
Red light false positives,https://www.reddit.com/r/teslamotors/comments/hvf9wr/red_light_false_positives/,"I have EAP, hardware 2.5. Lately, when cruising through intersections on AutoPilot, I have been getting a noticeable increase in occurrences where the car will suddenly flash the TAKE OVER IMMEDIATELY red hands and steering wheel (along with a red stop light in the corner). The car continues on its way and doesn't actually hand back control, but it is startling and annoying. The light is clearly green but the car seems to think it's red. Is this an issue related to HW 2.5 or something else? Anybody else noticing an uptick of this glitch lately?",12,2020-07-22 08:34:37,364
Getting stealth eco hitch installed on my model 3 today,https://www.reddit.com/r/teslamotors/comments/hvcnt2/getting_stealth_eco_hitch_installed_on_my_model_3/,"The shop is stating that they will need to reset the Tesla scan tool which cost additional $300, all the YouTube videos I’ve watch with self install did not need to do this. Btw my hitch model is without the trailer wiring.

For those who got theirs installed did you have to reset your car via scan ?",16,2020-07-22 06:18:29,365
Lane Departure Warning Error,https://www.reddit.com/r/teslamotors/comments/hvbegn/lane_departure_warning_error/,I'm experiencing a weird bug where when I'm signaling and then change lanes the Lane Departure System alarms and tells me to take control immediately. It's an internment problem but every time it's happened I've had had my turn signal activated... Any one experience this before? I'm driving a 2020 M3 performance with 2020.24,12,2020-07-22 05:13:21,366
New super charger incoming Salem Oregon center st target parking lot,https://www.reddit.com/r/teslamotors/comments/hux1ao/new_super_charger_incoming_salem_oregon_center_st/,,163,2020-07-21 12:09:33,367
Autopilot will switch lanes automatically in city streets in a few months,https://www.reddit.com/r/teslamotors/comments/huj1dg/autopilot_will_switch_lanes_automatically_in_city/,,1609,2020-07-20 22:35:37,368
Late roadster up for sale for $1.5 million. New old stock.,https://www.reddit.com/r/teslamotors/comments/huza5y/late_roadster_up_for_sale_for_15_million_new_old/,,82,2020-07-21 14:36:57,369
Michigan insurance,https://www.reddit.com/r/teslamotors/comments/hvu2qi/michigan_insurance/,"Michigan has ridiculously high insurance because for years they’ve required unlimited medical benefit coverage as well as being a NoFault state (meaning YourFault)...

So i know insurance will be expensive but i’m interested in how much of a premium i would have to pay for a Tesla.

For a Model Y, how much more can you expect to pay per six months vs a $50k non-Tesla car?

I imagine it’s more because all the sensors and gadgetry tends to increase insurance (looking at you Subie)

Also, does charging at home increase home insurance costs (assuming my insurance company who i use for auto and home would figure out there’s gonna be a charger installed in the garage...)

Thanks",0,2020-07-23 01:47:43,370
Tesla cars evolution database,https://www.reddit.com/r/teslamotors/comments/hv4ha0/tesla_cars_evolution_database/,"I see different naming for tesla cars, like 60, 70, 100P, Raven, but it's really confusing to understand.

Do you know some structured database with all tesla cars, year by year with all specs?

Something like already exists for apple devices [https://mactracker.ca](https://mactracker.ca), but for Tesla cars, so I can compare and review them one by one",22,2020-07-21 21:38:55,371
"Daily Q&A, Discussion, and Support Thread - July 21",https://www.reddit.com/r/teslamotors/comments/hv46c5/daily_qa_discussion_and_support_thread_july_21/,"If you are new here (or even if you're not), please skim through our [Rules](https://www.reddit.com/r/teslamotors/wiki/rules) to get more familiarity on potential updates or changes and what to expect.

Use this recurring thread for basic Q&A, vehicle assistance, today's topics, sightings, customization, shop item discussions, etc.  **If you are a new owner and want to share your experiences, look for our recurring Monday [New Delivery/Owner](https://www.reddit.com/r/teslamotors/search/?q=%22New+Delivery+and+Owners+Thread%22&include_over_18=on&restrict_sr=on&sort=new) threads.**

**Have a curiosity or concern?**   
- [Displayed/Rated Range](https://www.reddit.com/r/teslamotors/comments/epy1uh/daily_discussion_support_thread_january_17/fenj4n8) | [Tesla Support](https://www.tesla.com/support) | [Winter Driving](https://www.tesla.com/support/winter-driving-tips) | [Software Updates + Megathreads](https://www.reddit.com/r/teslamotors/wiki/softwareupdates)  

**Useful sites for vehicle management, software tracking, trip planning, and more**    
- [Teslascope](https://teslascope.com/software) | [TeslaFi](https://teslafi.com/firmware/) | [EV-FW](http://ev-fw.com/track-reports.php) | [Teslabout](https://teslabout.com/firmware) | [Useful Sites Wiki](https://www.reddit.com/r/teslamotors/wiki/usefulsites)    

**Vehicle Manuals - U.S.**  
- [Model S](https://www.tesla.com/sites/default/files/model_s_owners_manual_north_america_en_us.pdf) | [Model 3](https://www.tesla.com/sites/default/files/model_3_owners_manual_north_america_en.pdf) | [Model X](https://www.tesla.com/sites/default/files/model_x_owners_manual_north_america_en.pdf) | [Model Y](https://www.tesla.com/sites/default/files/model_y_owners_manual_north_america_en.pdf)  

**Resources:**  
- [Rules](https://www.reddit.com/r/teslamotors/wiki/rules)  
- [Gigathread](https://www.reddit.com/r/teslamotors/comments/cdxuwh/gigathread_of_resources/) - Recent Highlights and Links    
- [Popular Accessories](https://www.reddit.com/r/teslamotors/wiki/accessories)  
- r/AutoDetailing - Cleaning/detailing tips  
- [Discord Live Chat](https://discord.gg/7WuEqAW)  
- [Subreddit Wiki](https://www.reddit.com/r/teslamotors/wiki/index)  
- [Tesla Vehicle History Comparisons](https://docs.google.com/spreadsheets/d/1Rv464J1RsXNBNddy008IPsQfVrO4kHPh_L4HWKpG4bo/edit#gid=0)  
- Print your own [Shareable Card](https://drive.google.com/drive/folders/1URFRBNFIcuhpKr_fgtPaYXVc83m7EHQs?usp=sharing) by u/backstreetatnight and u/110110  

**Please be kind**, [genuine](https://www.reddit.com/r/teslamotors/comments/8rc3jg/be_genuine/), and welcoming.  If you want to share a photo, you can easily create an image post on Imgur and include it in your comment.  Find past discussions [here](https://www.reddit.com/r/teslamotors/search?q=author%3AAutoModerator+title%3A%22Discussion%22&restrict_sr=on&include_over_18=on&sort=new&t=all).",8,2020-07-21 21:10:43,372
2013 85kwh Model S vs 2020 Model Y Performance,https://www.reddit.com/r/teslamotors/comments/hupz2m/2013_85kwh_model_s_vs_2020_model_y_performance/,"We purchased a Model S in 2013. It’s been my daily driver for the past 7 years and \~92,000 miles. We’ve been happy enough with it that my wife decided to get a Tesla when it was time for her new car. She could have had an X or S, but she picked the Y.  

We’ve had it for a few weeks now and thought I would share some thoughts. 

**Short version:**  No surprise, a new Model Y is an overall better car than a 7 year old Model S. Of course, you can get a used 2013 Tesla for less than a new Model Y, so I guess the market agrees. That said, money aside, a new Model S is still the best Tesla IMHO. Obviously, my wife disagrees. 😊

**Details:**

**Buying/delivery experience** – Buying our Model S in 2013 was a big deal. Pick up including the whole factory tour and someone patiently going over every detail. Buying the Model Y was the opposite. It was like click, click, wait 4 weeks, go to pick up, someone says ‘yep, it’s over there’, drive away.  In some ways, I preferred doing it that way, but it’s still a bit anti-climactic.

**Initial quality** – We had several issues with our Model S to start with. Even some dings when we accepted delivery. Main issues covered by warranty over time, but still.  Given the quarter end rush and Model Y being new, I expected more of the same. I spent at least 30 minutes looking for issues before we even took delivery. However, I haven’t been able to find a single issue with the Model Y. No problems at all over the last few weeks, either functionally or cosmetically. The build quality seems solid all around. I know some folks have been complaining online, but we have had zero issues so far (knock on wood).

**Exterior design** – I still like my Model S better, but honestly the Model Y looks great in person. Much better in person than online. Better than the X or 3 IMHO and my wife thinks it’s the best looking Tesla.

**Interior design** – Again, I prefer the look of the interior of the Model S. The dual screen set up with the larger center screen makes the interior feel more complete and functional. That said, the center screen on the Model Y is just fine and is surprisingly natural to drive with the one center console.   
The seats and seating position on the Model Y are much better. Not only are you physically sitting in a more comfortable position, but the seats themselves are more comfortable. I understand newer Model S’s have better seats, but the 2013 seats are not great. That said, easier to stretch out on a Model S given the increased size.   
I think storage is better in the Model S, even though the total cubic feet may be better in the Y. Model Y is taller, but Model S is wider and that seems more important for most stuff.   
There is less wind noise in the Model S, but both are great.   
Visibility is better in the Y.

**Driving experience** – Model Y is quicker on paper and NOTICEABLY quicker in person. Super fun to zip around and I would rather be in the Model Y both for long trips and around town. Autopilot is a plus, but for me I only want to use it in stop and go traffic or on a long steady stretch of highway. Handling is great with the Y. Main area I would give the nod to the 2013 Model S is on sweeping high speed roads. Again, with a new Model S, I think the overall equation would change with more range, faster speed, better seats.

**Battery** – The Performance Model Y w/ the Performance Upgrade Package and my 2013 Model S have almost the same range. When I bought the Model S, the range was 266 miles. Since then, it went to a top of 290 miles as Tesla pushed out improvements to battery management. Now it maxes around 284 and the Y with PUP is 280.  
Side note - I love driving by my neighbor every day who told me when I bought the Model S that I would have to buy a new battery pack in 3 years. 😊

**Value for money** – yeah, Model Y. No question.

**My next car** – So the wife gets the Model Y. Again, she preferred it over a new Model S, but personally I do not.  For me, my 2013 is still going strong, it's paid off and I am in no hurry.  By the time I need to replace it, I think it will be between the nextgen Model S or a CyberTruck.",131,2020-07-21 05:52:27,373
Note about Tesla Insurance and Moving,https://www.reddit.com/r/teslamotors/comments/huyhhh/note_about_tesla_insurance_and_moving/,"Last week I read about folks starting to receive their rebates on their insurance policies that Tesla promised due to COVID-19. I hadn’t received anything yet, so I gave Tesla Insurance a call. I moved to a new residence since I first signed up for my policy. I updated my address in my Tesla account right when I moved, and I figured all was well. Turns out, Tesla Insurance doesn’t refer to your address on record in your Tesla account. There is no way to update your address with Tesla Insurance online. The representative told me that my rebate check was sent to my old address, and then asked me to provide him with my new one. When I let him know that I thought I had already updated my address via my account on Tesla.com, he said they don’t look at that and the only way to update it is to call them. Kind of annoying, and I could see others making this same mistake. Just wanted to let ya’ll know!

TLDR: If you move and you have Tesla Insurance, the only way to update your address is to call them during business hours. Updating via Tesla account at Tesla.com doesn’t work.",31,2020-07-21 13:43:19,374
Made A Model 3 Cabin Air Filter Installation / Coil Foam Tutorial Video After Suffering From A Stinky Summer Air Conditioner,https://www.reddit.com/r/teslamotors/comments/hupvz7/made_a_model_3_cabin_air_filter_installation_coil/,,115,2020-07-21 05:47:58,375
Strangest Delivery Experience,https://www.reddit.com/r/teslamotors/comments/husp80/strangest_delivery_experience/,"I got a call last Thursday from Tesla telling me my Model Y is here at the Ottawa service centre ready for delivery, we scheduled to pick up the vehicle at 1 pm today. When I got there this afternoon and opened my app, I had full control over everything like AC, Window and trunk, I honked through the app, but heard nothing. Next thing I checked the location, the car was sitting in a parking lot in west Chicago...Got someone on the phone from Telsa, and he said there were some paperwork that needed to be done and ""couldn't just give me a free car""😡🤬. Still waiting for a call-back on when it can be delivered.
I don't know what kind of chaos goes on at the back end for them to mess up this badly. I still have control over the car through the app though, I can do the software update meanwhile I guess🤷‍♂️",71,2020-07-21 08:09:54,376
"Elon Musk's Boring Company confirms use of Tesla Model S, X, and 3 in new 'Loop'",https://www.reddit.com/r/teslamotors/comments/huq3mh/elon_musks_boring_company_confirms_use_of_tesla/,,93,2020-07-21 05:58:58,377
We need 3 preset / scheduled charging options for our Tesla’s,https://www.reddit.com/r/teslamotors/comments/hvo07e/we_need_3_preset_scheduled_charging_options_for/,"Feature Request: 3 preset charging levels. Weekday, weekend and nightly.


Weekday- lets us set a less than regular charge level to top off the batteries anytime we plug in the car. That way we get some charge recovery during the day if we have a low charge. 

Example forgot to plug in car night before.  

Weekend - Party time baby! Recharges to a higher level anytime on a weekend we plug in the car. 

Nightly - The regular after x:xx pm cheap recharge we know and love.  

So for us.  Weekday tops us off after grocery runs etc back to say %50-60% Weekend %80 Nightly %75

This would allow us a safety weekday recharge buffer just in case we have to dash off somewhere.",0,2020-07-22 17:34:11,378
0 down model Y lease,https://www.reddit.com/r/teslamotors/comments/hvidv5/0_down_model_y_lease/,"Hi - I’m looking to finally make the move to an EV. I typically only drive 12k miles a year so I’ve leased every vehicle I’ve ever had. I have always put down $0 because with a lease it’s the smart move - if you total the thing driving it off the parking lot you are SOL with any down payment. 

I’m looking at this model Y lease that’s been making the news over the past week. 4.5k down $500 a month. 

Does Tesla offer flexibility with a down payment. Do they allow you to build it into the monthly payment instead? It’s not a dealbreaker but preferred method for me. 

I have a 820 credit score if that has any impact. 

Excited to join the club.",0,2020-07-22 11:24:05,379
"Elon hinting at new ""deep crimson"" colour from Giga Berlin on Twitter",https://www.reddit.com/r/teslamotors/comments/hu8dd9/elon_hinting_at_new_deep_crimson_colour_from_giga/,,3145,2020-07-20 09:18:25,380
Samsung SSD T5 or T7,https://www.reddit.com/r/teslamotors/comments/hv0miw/samsung_ssd_t5_or_t7/,"I know a lot of people love the Samsung SSD T5 for sentry mode/dash cam. In the past I used a USB stick that was compatible with viewing from my phone. Now that the car allows viewing from the dash, I’m looking to upgrade to an SSD. Amazon has the newer T7 listed as cheaper than the 5. Anyone aware of any disadvantages with the 7? Anyone have problems fitting the longer dimensions in the Jeda hub? Thanks for any feedback.

Edit: Thanks for the feedback. Great discussion. Some people mentioned unloading their drives (I assume to make room). Is this necessary any longer, other than exporting a relevant file, with the drive writing over itself when full?",8,2020-07-21 16:11:24,381
And another Gigafactory 4 Berlin video - this one has a fly-through the concrete structures!,https://www.reddit.com/r/teslamotors/comments/huosv6/and_another_gigafactory_4_berlin_video_this_one/,,67,2020-07-21 04:53:03,382
