Title,URL,Body,Upvotes,Time,Key
Tesla launches its own car wrap service,https://www.reddit.com/r/teslamotors/comments/i4pbja/tesla_launches_its_own_car_wrap_service/,,3556,2020-08-06 22:28:25,1
"Tesla Model 3 is the fastest-selling used car, study suggests",https://www.reddit.com/r/teslamotors/comments/i4yvge/tesla_model_3_is_the_fastestselling_used_car/,,199,2020-08-07 07:53:15,2
How Cybertruck has already saved a life.,https://www.reddit.com/r/teslamotors/comments/i4utcz/how_cybertruck_has_already_saved_a_life/,"I've been meaning to share this story for a while now, but am just now getting around to writing it up and posting it. It is a big long, but I hope you enjoy it. This is my story about how the Cybertruck has already saved a life (or more accurately saved one almost immediately after it was revealed.

The story starts a little over a year ago; when we took delivery of our Model 3. I had been following Tesla for year and was 20th in line to reserve a Model 3 three years prior, but circumstances prevented us from getting it when we first got our email. Well on April 1st 2019 we were finally able to justify the down payment with a new job and a long daily commute for taking the kids to school and we picked up our car. My wife, while skeptical at the time, thought it was a good choice just given the gas savings (we were spending >$400/month in gas). She wasn't so sure she would like the car, especially given that she would be the one driving it 95% of the time. Well, lo and behold, she loved it. It didn’t have as many technical issues that she thought it would have given the technology in it and she got to the point where she hated having to drive our other vehicle. The Model 3 just made her daily commute so much easier and she never had to deal with stopping for gas, let alone doing it twice a week or more.

Flash forward 3 months. My wife has been loving the car and has even been using it to do Uber/Lyft to make some extra money. She didn’t do this often as she has never liked being around strangers and gets bad anxiety, but occasionally she would get in the mood to do some driving on the weekends or after dropping the kids off at school. Then summer hits.....

My wife's anxiety and stranger issues stem from her PTSD. She was abused physically and mentally for 11 years as a child at the hands of her stepfather while her mother stood by and did nothing. Even married the man AFTER my wife finally got out of the house, which didn’t make things better. Normally I can help her through her episodes but this time she was visiting a friend in another state when the episode hit and it was a bad one. Long story short, she ended up in a hospital and we had to fight the court to get her out. In the meantime she was pumped full of so much medicine that it completed f'ed any mental control she had. They gave her stuff I told them not to that sent her into cluster seizures and something that gave her extremely vivid nightmares for months. Thankfully we got her out within a week and I was able to get her back home, but she wasn’t the same person. We visited some local hospitals and found a local therapy place to try and help her but she had fallen into an extremely deep depression. For months I worried that every day may be the last day she was here and I did everything to remind her of what she had and try and bring her back. Her doctor worked with us to play with some medicine to at least stabilize her mood swings which were uncontrollable the entire time, but it wasn't a fast process and at least 3-4 times a week she would have terrible meltdowns.

After about 4 months we were able to get her medicine mostly figured out while she continued to go to weekly therapy sessions and she was at least somewhat stable. She only had issues maybe once per week, but was still in a very deep depression and I continued to worry every day that something could go wrong and I would lose her.

November 21st, 2019........

My wife as sleeping. She spent most of her time sleeping when I was home. That was her usual when she was in a depressions, but it was better than the alternative sometimes. I had gotten the kids to bed and was playing some games while waiting for the Cybertruck reveal. My wife knew we were planning to get the truck even before the reveal, but didn't really care. She knew a truck would be much more useful and would get us on all Tesla vehicles, but she really wanted an x even though we couldn’t afford it in the configuration we would need for traveling. I knew the truck was going to be a controversial design and sure enough when I saw it I wasn’t super impressed. I thought the design was interesting but wasn’t immediately something that I was drawn too. I thought it was neat but it wasn’t something amazing. Nonetheless, the next morning I decided to show my wife while we were lying in bed, but not quite ready to get up.

Cue the awakening.....

When my wife saw the truck come out, she was stunned; she absolutely loved the design! I don’t know why; I don’t think she knew why, but she fell in love with the truck. She no longer wanted the X, she wanted our next car to be the Cybertruck. She spent the next several hours watching and re-watching the reveal video and looking at every detail of the truck. Seeing how she reacted to it, I realized an opportunity and went downstairs to put in our reservation for the truck. I printed out the email and showed it to her and she was ecstatic for the first time in 4 months. It was like the old her came back out for the first time. I told her she needed to help save for it and she jumped at the opportunity. She put together charts and motivational pictures and started driving for Uber again with our 3. She has completely changed since that moment she saw the truck and is back to her old self. She has been saving money so we can get the truck as soon as our name comes up and has has a complete turnaround form constant depression to excited giddiness since that day in November. She has been following everything that comes out about the truck, has replaced her favorite hat with a Tesla hat, and gets into excited conversations about the truck with other Tesla owners when we are charging (took a trip across country since the reveal).

This past 9 months has been an amazing time for us as she's gotten back to her old self and she's been working hard to save as much as possible. We've had some setbacks (corona, our 3 getting totaled (just replaced with a y)), but still have saved up a good amount and vie since had a good pay increase so I am helping her by sending money every paycheck into the savings account. All I can say is ""Thank You Tesla"". The Cybertruck probably saved my wife's life, our family, and my sanity.",347,2020-08-07 04:22:11,3
TIL: Touch and hold the time/clock for 5-10 seconds to recalibrate.,https://www.reddit.com/r/teslamotors/comments/i50ofu/til_touch_and_hold_the_timeclock_for_510_seconds/,"After updating my model 3 to 2020.28.6 my clock was an hour and a few minutes off strangely. I noticed that by pressing and holding on the time for a few seconds, it adjusted to the correct time.

Maybe this is already well known, but thought I’d share!",115,2020-08-07 09:29:32,4
"Mobile HW3 install has been a breeze and completely remote, awesome service. Made the appointment last week through the app, arrived right on time and let me know via text they had already started working.",https://www.reddit.com/r/teslamotors/comments/i4w2yh/mobile_hw3_install_has_been_a_breeze_and/,,159,2020-08-07 05:28:06,5
"Size comparison of X, Y, and 3.",https://www.reddit.com/r/teslamotors/comments/i4sefj/size_comparison_of_x_y_and_3/,,255,2020-08-07 02:05:51,6
CANADA - ENABLE kWh-BILLING FOR EV CHARGING - Engage Tesla,https://www.reddit.com/r/teslamotors/comments/i4zgnq/canada_enable_kwhbilling_for_ev_charging_engage/,,38,2020-08-07 08:24:53,7
"Constant ""Charging Interrupted"" with Gen 3 Wall Charger (solution)",https://www.reddit.com/r/teslamotors/comments/i52837/constant_charging_interrupted_with_gen_3_wall/,"I LOVE my brand new 2020 S100D long range and was excited to get a brand new wall charger professionally installed so that I might actually be able to drive it! For the first few weeks I had zero problem with the charger, but after a couple of updates it now will interrupt charging 4-5 times a night. It's a pain, and I've seen this posted all over reddit and the Tesla owners forums, but the solutions they all tried (check for loose wires, etc.) did not work for me, so I opened a ticket with Tesla.

Did you know your wall charger has a wifi adapter in it? I didn't. The technician has informed me that this is a known issue with this particular firmware version, and that an updated firmware should resolve the issue. The wall charger is overheating, which is why some have had success by turning down the charging rate (Mine is at 48Amps). 

The solution is to use the QR code in the quickstart manual as well as the password to connect to the wall charger's wifi network (kind of like an Amazon echo does) and configure the wifi on the wall charger. Within a couple of hours of being unplugged from the car it will download the latest firmware which should fix the issue. I thought I would post this here in case anyone else is having the same problem.",24,2020-08-07 10:54:59,8
Cross Country Trip in Model Y,https://www.reddit.com/r/teslamotors/comments/i57c6m/cross_country_trip_in_model_y/,"We’re moving across the country (CA to NY) late Sept/early Oct. With everything going on, we’re weighing the options of driving across the country in our Model Y (versus flying) and thinking of camping out in the back (versus limiting the hotel stays along the way).  Not sure if this will be a bad idea or not. 

Has anyone done a road trip across the country since the pandemic has started? Are the super charging stations pretty reliable to make it all the way across? Is the WiFi reliable enough to work from in the car/take VC calls? Any light weight camping setups that won’t take up all of the back seat? Would the mini fridge be a bad idea?Any other advice or tips? 

We fortunately are not time or budget crunched but mainly want to avoid as much exposure as possible along the trip.",7,2020-08-07 16:30:07,9
Tesla Model Y RWD Delivery Text Update,https://www.reddit.com/r/teslamotors/comments/i4ytm2/tesla_model_y_rwd_delivery_text_update/,"I just got a text from Tesla saying my Model Y RWD would be ready in 5-8 weeks. It also said I could get a different model sooner. So I don't know if its true that it'll be ready in 5-8 weeks or if they are just trying to get me to buy an AWD. 

My Model Y Reservation is White and the rear bumper mismatch color really bugs me. I was tracking it when it was a problem with the 3 and I hope it gets resolved. My reservation is still the $2,500 one right before the hiked FSD from $6,000 to $7,000. 

Based on the price reduction and if the RWD gets priced at $45k, it should come out to nearly the same price with FSD at $8k if I just cancel it and change the color. Just waiting on hard numbers before canceling my $2,500 reservation. 

I really wanted a white Y to go with my black 3.


Update: just got another text saying it was an error.",22,2020-08-07 07:50:32,10
"Having an absolute terrible time with the service centre, is there anything I can do?",https://www.reddit.com/r/teslamotors/comments/i50s3i/having_an_absolute_terrible_time_with_the_service/,"Dropped the car off for a HW3 upgrade in the morning, on the phone prior, I was told it would take 2 hours tops.

When I arrived, I had intended to wait for the car to be upgraded, about an hour later, they informed me that they were having difficulty with the install and that it wouldn’t be ready until 3pm. They also told me that they have no loaner available, and so they can provide me with Uber credits to get back to work. I took the Uber credits and went back to work. 

At 3pm, I had heard nothing from them so I decided to call and was told that the update to the software kept failing and that it wasn’t going to be ready until 5pm. I asked if they could call me at 430 and let me know if I should leave to come and get it.

They called and said that I should start making my way over. So I leave work and get on the highway; which is now rush hour traffic, I get about 20 minutes into the drive only for them to call back and tell me that the update failed again, and that they are closing for the night.

They claim it is due to the wifi in their service centre being poor and they will try to push the update as they are leaving so no one will be on the network, but that they have to keep the car overnight. So I ask the Uber to return me home, and I gotta say I’m pretty upset. What was suppose to be a 2 hour service appointment has now turned into me not having a vehicle for at least 24 hours, assuming the update even occurs and the car is ready for pickup tomorrow at 9.

I have a family and had to arrange for children to be picked up from their grandparents, I will also have to arrange for them to be dropped off tomorrow at their grandparents, as I’m not gonna send them in an Uber...

Coincidentally, I was supposed to go to a “drive in concert” for A Tribe Called Red in Toronto tonight, it starts at 7pm, an hour and a half, and I am frantically trying to find a friend whose car i can borrow as I will need a car for the show, or I’m out of luck with even going...

I know perhaps it was foolish to book a service centre upgrade to my FSD and a drive in concert on the same day, but it just worked out that way. Had the FSD appointment for a month, and the concert tickets were bought a week ago... figured it wouldn’t be an issue given that the FSD upgrade in everyone else experience only takes about an hour and a half...

So yea... that’s my story... any thoughts? I’m pretty frustrated...

Is there anything I can do?",13,2020-08-07 09:35:01,11
Stolen Side View Mirror - Warning,https://www.reddit.com/r/teslamotors/comments/i4z65n/stolen_side_view_mirror_warning/,"I just got a Model X a few weeks ago after finally trimming quite a bit of fat from my budget.  I was indescribably angry to find my left (driver's) side view mirror had been stolen in NYC sometime between 2am and 8:15am on 3-Aug-2020. The thief stole only the glass part of the mirror, and was able to pop it off without damaging the 3 wires (please see picture). The dealer where I just bought it  said I would have to replace the entire component ($675, plus $195/hour labor + tax = $946).  I'm looking into fixing it myself by sourcing the part online or heading to auto parts shops in the area.

Does anyone have any prevention tips so I don't run into this in the future? Any suggestions will be greatly appreciated, including any tips you may have regarding pursuit of justice.  Sentry Mode captured video of (presumably) everyone who triggered the proximity sensors:  mostly joggers, garbage men & other passersby but no one close to the mirror.  Around 7am it also captured 65 minutes of video of workers gathering at the job site next to my car arriving for work, waiting around, and then climbing up scaffolding.  It captured a lot of clear video of faces which could help identify the thief, but nothing that clearly shows someone stealing the mirror.  Similarly, I've looked at security camera footage from a few stores & apt buildings but I haven't found anything yet which captures the crime being committed.  I mentioned Sentry Mode but the cops said ""we're not going to be able to do anything"" without even looking at the videos that were captured.  I said thanks for taking the report -- for my insurance and also for CompStat to have the data to record the crime -- and off they went.

A quick google search indicates this crime has been on the rise for a few years, so I'm posting as a warning to other Tesla owners (and, I guess, all other car owners with similar tech in the mirrors like auto dim, sensors, and motors).  Before they left, the cops said there are dozens of auto parts stores (chop shops) less than a mile away in the Hunts Point section of the south Bronx, as well as across the East River in Queens.  Thieves can pop the mirrors off in <5 seconds with a flathead screwdriver, go to the chop shop, and get anywhere from $20 to $150 per mirror depending on type, condition, etc.

https://preview.redd.it/mahq0emk6gf51.jpg?width=3024&format=pjpg&auto=webp&s=68b04eddfe521a150fa1e4ab264936fc9a9f6fd6",12,2020-08-07 08:09:10,12
"Small changes on the latest Model 3 from Giga Shanghai, Finally fixed the rain drops into trunk.",https://www.reddit.com/r/teslamotors/comments/i48num/small_changes_on_the_latest_model_3_from_giga/,,1829,2020-08-06 04:36:31,13
"Powerwall as a backup system for outages, but without solar",https://www.reddit.com/r/teslamotors/comments/i4xf6h/powerwall_as_a_backup_system_for_outages_but/,"With the multi-day power outage in NJ, we’ve been considering backup systems to be better prepared for next time. We actually had some discussions ongoing with our contractor about installing a whole-house 20 kW natural gas generator when the storm hit. I didn’t know much about Tesla Powerwall, but reading about it more makes it sound like an interesting alternative. I’m not sure if I’m thinking about this the right way, so could use some advice.

Looking at electricity bills, our average daily consumption is 37 kWh in the summer and 18 kWh in the winter. The summer consumption includes a central AC maintained at 73-75 F throughout the day. Most of our other heavy appliances (dryer, water heater, steam boiler) are gas-powered, and we don’t have a well or sump pumps. I expect our usage during an outage will be much lower than either of these numbers since we only need to operate lights, fans (at night) and small electronic devices for the most part, and can easily survive without AC. Installing 2 Powerwalls will give us 25-26 kWh of total capacity and 10 kW of power, which seems sufficient for a 2-3 day outage.

The total installed cost for the Powerwalls is $17k + tax, which is incidentally almost exactly the same as what was quoted for the natural gas generator (it needs breaking up our back patio and digging up our lawn, not a simple installation). While the generator gives us unlimited capacity and double the power, the lack of noise or maintenance and freedom of location for the Powerwalls is a big draw for me, especially given our consumption and the fact that outages happen maybe once or twice a year. For longer outages, we plan to have a small portable gas powered generator available to use in the worst case.

Adding solar to the Powerwalls actually brings the total cost down to $14k (credits + bundle discount), but I’m not a big fan of having solar panels on our beautiful hundred year old slate roof. We also have very heavy tree cover, so it’s unlikely they will provide much value. My husband still wants to consider them, but I wanted to make sure that the Powerwalls are not a terrible decision even without solar.

Sorry for the long post, but really eager to hear others thoughts and experiences!",11,2020-08-07 06:37:57,14
My humps!,https://www.reddit.com/r/teslamotors/comments/i4rimp/my_humps/,"Washington, D.C. has speed humps... quite a lot in some places. I’ve never seen one recognized and unless I intervene, the car goes over at full speed. It’s would be pretty awesome if autopilot could recognize speed humps (and bumps).",29,2020-08-07 01:09:30,15
Tesla to Storm Pikes Peak International Hill Climb - Pikes Peak International Hill Climb,https://www.reddit.com/r/teslamotors/comments/i4ho4y/tesla_to_storm_pikes_peak_international_hill/,,185,2020-08-06 12:43:45,16
